{
  "approval_id": "apr_2f90b1cc",
  "requester": {
    "type": "ai_agent",
    "id": "agt_4f21c09ab3e1"
  },
  "user": "punar",
  "capability": "credential.request",
  "resource": "aws-dev",
  "reason": "Atlas deploy needs the dev account",
  "risk": "medium",
  "status": "approved",
  "expires_at": "2026-08-25T10:05:00Z"
}
